{
  "schema_version": 1,
  "revision": 1,
  "device": {"display_name": "Bear Den", "preferred_display": "auto"},
  "ui": {"theme":"den-dark","accent":"#79A889","background":"den-gradient","text_scale":1.0,"tile_density":"comfortable","safe_margin_percent":3,"reduced_motion":false,"high_contrast_focus":false,"hero_enabled":true,"clock_enabled":true,"art_style":"pixel"},
  "applications": [
    {"id":"plex-htpc","label":"Plex","adapter":"plex-htpc","launch":{"kind":"flatpak","app_id":"tv.plex.PlexHTPC","args":[]},"home_policy":"pause-if-supported","remote_enabled":true},
    {"id":"youtube","label":"YouTube","adapter":"vacuumtube","launch":{"kind":"flatpak","app_id":"rocks.shy.VacuumTube","args":["--fullscreen","--no-window-decorations"]},"home_policy":"pause-if-supported","remote_enabled":true},
    {"id":"moonlight","label":"Moonlight","adapter":"moonlight","launch":{"kind":"flatpak","app_id":"com.moonlight_stream.Moonlight","args":[]},"home_policy":"leave-running","remote_enabled":true},
    {"id":"spotify","label":"Spotify","adapter":"spotify","launch":{"kind":"flatpak","app_id":"com.spotify.Client","args":[]},"home_policy":"leave-running","remote_enabled":true,"hide_when_missing":true},
    {"id":"jellyfin","label":"Jellyfin","adapter":"jellyfin","launch":{"kind":"flatpak","app_id":"org.jellyfin.JellyfinDesktop","args":["--fullscreen","--tv"]},"home_policy":"pause-if-supported","remote_enabled":true,"hide_when_missing":true},
    {"id":"retroarch","label":"RetroArch","adapter":"retroarch","launch":{"kind":"flatpak","app_id":"org.libretro.RetroArch","args":["--fullscreen"]},"home_policy":"pause-if-supported","remote_enabled":true,"hide_when_missing":true}
  ],
  "sections": [
    {"id":"favorites","title":"Your Apps","kind":"applications","enabled":true,"application_ids":["plex-htpc","youtube","moonlight","spotify","jellyfin","retroarch"],"hide_when_empty":false},
    {"id":"plex-continue","title":"Continue Watching","kind":"plex-continue-watching","enabled":false,"hide_when_empty":true},
    {"id":"plex-recent","title":"Recently Added","kind":"plex-recently-added","enabled":false,"hide_when_empty":true}
  ],
  "plex_content": {"enabled": false, "connection_ref": null},
  "remote": {"enabled":false,"transport":"trusted-lan-http","port":8090,"interfaces":[],"allowed_hosts":[],"mdns":true,"http_layout_editing":false,"now_playing":true,"pairing_expiry_seconds":120,"pairing_max_attempts":5,"https":{"certificate_file":null,"private_key_file":null}},
  "cache": {"artwork_max_mib": 512},
  "startup": {"autostart_enabled": false},
  "privacy": {"telemetry_enabled": false},
  "onboarding": {"completed": false, "lan_consent": false},
  "weather": {"enabled": false, "place": null, "units": "celsius", "scene": true}
}
